map_id,our_mode,our_status,comptia_mode,jason_dion_style_topics,landing_page_role,next_build_piece,route_module,route_action
MAP-001,Hardware Bench,built docs and partial app assets,Hardware,"Cable types; motherboards; cooling and power; system memory; BIOS/UEFI; storage device; printers and MFDs; printer types; laptop hardware",Learner identifies physical parts and ports before troubleshooting,Add hardware visual selector,drag,Start Connector Match
MAP-002,Network Table,built docs and topology app,Networking,"Cable types; networking basics; wireless networks; internet connections; network addressing and communication; network configurations; network servers and services",Learner traces network paths and matches symptoms to checks,Add network route tile to landing page,topology,Trace Network Path
MAP-003,OS and VM Station,docs only,Virtualization and Cloud Computing,"Virtualization concepts; cloud computing; storage device",Learner enters VM and cloud concepts through visual examples,Add VM and cloud flash cards,flash,Review Visual Cards
MAP-004,Mobile and Laptop Tray,built starter,Mobile Devices,"Laptops and mobile devices; mobile applications; laptop hardware; troubleshooting mobile devices",Learner practices laptop hardware part recognition before broader mobile modules,Add mobile app practice,laptop,Open Laptop Hardware
MAP-005,Troubleshooting Wall,built docs ticket app and symptom app,Hardware and Networking Troubleshooting,"Troubleshooting methodology; troubleshooting hardware issues; troubleshooting storage devices; troubleshooting video issues; troubleshooting networks; troubleshooting mobile devices; troubleshooting printer devices",Learner starts from a symptom or ticket and moves to evidence,Link tickets to domains,tickets,Open Ticket Board
MAP-006,Security Station,docs only later Core 2 expansion,Later Core 2 and safety layer,"Intro; safe handling; suspicious-message practice; privacy checks",Learner keeps safety visible without treating it as a Core 1 domain,Add Core 2 map later,symptoms,Match Safe Checks
